{
  "$schema": "https://json-schema.org/draft/2020-12/schema",
  "$id": "https://sigilo-dev.github.io/A3/schemas/e0/relation.schema.json",
  "type": "object",
  "properties": {
    "schemaVersion": {
      "const": "1.0.0"
    },
    "id": {
      "$ref": "https://sigilo-dev.github.io/A3/schemas/e0/common.schema.json#/$defs/uuid"
    },
    "revision": {
      "$ref": "https://sigilo-dev.github.io/A3/schemas/e0/common.schema.json#/$defs/revision"
    },
    "type": {
      "$ref": "https://sigilo-dev.github.io/A3/schemas/e0/common.schema.json#/$defs/namespace"
    },
    "typeVersion": {
      "$ref": "https://sigilo-dev.github.io/A3/schemas/e0/common.schema.json#/$defs/version"
    },
    "source": {
      "$ref": "https://sigilo-dev.github.io/A3/schemas/e0/common.schema.json#/$defs/endpoint"
    },
    "target": {
      "$ref": "https://sigilo-dev.github.io/A3/schemas/e0/common.schema.json#/$defs/endpoint"
    },
    "properties": {
      "$ref": "https://sigilo-dev.github.io/A3/schemas/e0/common.schema.json#/$defs/extensions"
    },
    "extensions": {
      "$ref": "https://sigilo-dev.github.io/A3/schemas/e0/common.schema.json#/$defs/extensions"
    }
  },
  "required": [
    "schemaVersion",
    "id",
    "revision",
    "type",
    "typeVersion",
    "source",
    "target",
    "properties",
    "extensions"
  ],
  "additionalProperties": true
}
