{
  "schemaVersion": "1.0.0",
  "id": "00000000-0000-4000-8000-000000000005",
  "revision": 1,
  "type": "a3.core.references",
  "typeVersion": "1.0.0",
  "source": {
    "entityId": "00000000-0000-4000-8000-000000000002"
  },
  "target": {
    "entityId": "00000000-0000-4000-8000-000000000003"
  },
  "properties": {},
  "extensions": {}
}
